body,score_hidden,archived,name,author,author_flair_text,downs,created_utc,subreddit_id,link_id,parent_id,score,retrieved_on,controversiality,gilded,id,subreddit,ups,distinguished,author_flair_css_class
"/r/linguistics may be be more helpful? Because certainly different accents are well known to be faster or slower. ",,,,pbntm,,,1510448289,t5_2sml9,t3_7bzqi8,t3_7bzqi8,1,1512547420,0,0,dpos077,AskSocialScience,,,
"Seems more of a question for /r/askhistorians especially considering there wasn't really a concept of ""teenagers"" until very recently.",,,,pbntm,,,1510448619,t5_2sml9,t3_7bnys4,t3_7bnys4,2,1512547550,0,0,dpos958,AskSocialScience,,,
"Well, in Chicago there was a program to help poor black families move to rich white suburbs that seemed to be a success. But the problem is that what often happens when when white people move to black neighborhoods it becomes gentrification and when black people move to white neighborhoods you end up with white flight.

https://www.theatlantic.com/business/archive/2015/02/is-ending-segregation-the-key-to-ending-poverty/385002/",,,,pbntm,,,1510449433,t5_2sml9,t3_7bw5b0,t3_7bw5b0,2,1512547875,0,0,dposvbf,AskSocialScience,,,
[deleted],,,,[deleted],,,1510494262,t5_2sml9,t3_7cept3,t3_7cept3,1,1512560158,0,0,dppfxor,AskSocialScience,,,
"I would say that structural violence is an aspect of institutional racism. This is the case if we take a relatively narrow definition of structural violence, such as James Gilligan's (Violence: Reflections on a National Epidemic):

""the increased rates of death and disability suffered by those who occupy the bottom rungs of society, as contrasted with the relatively lower death rates experienced by those who are above them"".

The institutional racism of American society then, by this definition, consists of structural violence as there is [a death rate disparity between African Americans and white Americans.](http://edition.cnn.com/2017/05/02/health/african-american-death-rates-cdc-study/index.html)",,,,Fresh-Snow,,,1510497485,t5_2sml9,t3_7cept3,t3_7cept3,9,1512561116,0,0,dpphnyn,AskSocialScience,,,
"I am not knowledgeable about trends and quantitative data, but the UNHCR does have listed [among its solutions](http://www.unhcr.org/solutions.html) what is known as voluntary repatriation, which is basically returning home. I only mention this because it may serve as a good starting point so it can help you in your own research on the question.

There is a very simplistic answer to your question though: refugees go back when it is safe for them to do so.

[The UNHCR emphasises that voluntary repatriation is the preferred solution to the issue of refugees](http://www.unhcr.org/excom/exconc/4b332bca9/conclusion-protracted-refugee-situations.html), but there are other solutions (resettlement and local integration) of course because it is not always feasible. 


I'd like to emphasise that using data and trends, especially historical ones, is not a very good way to compare the current refugee situation. This is because each situation is different and voluntary repatriation will depend on the outcomes of conflict and current affairs in their country.

For example: obviously Syria is not safe or suitable enough for Syrian refugees to return to, [but many Somali refugees have been repatriated from Kenya.](http://www.bbc.com/news/world-africa-20819462) 
",,,,Fresh-Snow,,,1510498773,t5_2sml9,t3_7cfn22,t3_7cfn22,2,1512561509,0,0,dppifgt,AskSocialScience,,,
"Thank you for your answer but I just deleted the question. I thought my question was too simplistic and decided to let the question brew in my head for a few days. ",,,,TanktopSamurai,,,1510498933,t5_2sml9,t3_7cfn22,t1_dppifgt,1,1512561558,0,0,dppij1v,AskSocialScience,,,
"Whatever floats your boat. ",,,,Fresh-Snow,,,1510498985,t5_2sml9,t3_7cfn22,t1_dppij1v,2,1512561574,0,0,dppik5z,AskSocialScience,,,
"It isn't a social science question exactly. There is an international multilateral treaty (The 1951 Convention Relating to the Status of Refugees) which lays out the rights of refugees and the obligations states have towards them. The main principal is 'non-refoulement' - the idea that refugees should not be returned to a place where they have a reasonable fear of persecution. The first country to receive refugees has an obligation to host them. Generally they must do so until one of three durable solutions have been found: local integration (permanently settle in the host country), voluntary repatriation (return home), or third-country settlement (gets permission to live in a new country). I assume you are North American or European, so usually we receive people who have already been refugees in other countries. So when we receive them they are allowed to permanently settle in our countries. About 85-90% of refugees actually live in poor to middle-income countries, so what we see in North America and Europe is just a small sample of a very large world problem. According to the 1951 Convention, there is no limit on how many refugees a host country should accept, just how they should be treated. So a short answer to your question - if you live in a rich country, the refugees you see are probably soon-to-be-residents and aren't going anywhere. ",,,,tmacnb,,,1510499072,t5_2sml9,t3_7cfn22,t3_7cfn22,1,1512561599,0,0,dppim30,AskSocialScience,,,
"Source: I work with refugees for a nonprofit.

The answer is ""whenever they are ready."" Once they feel they can safely return home, then they are allowed to do so. This amount of time will vary wildly between each case, as every refugee's situation is different. Their official social services end after 3 months of being here (at least in my state). All of them are offered an optional pathway to citizenship after 5 years, but they are not required to take it.

As for the numbers on how long the average refugee will stay (or on if they don't leave), they might not be very meaningful to analyze. Some can retain refugee status for over 40 years. With this current crisis, it's too early to tell.

Here's a bit of reading on this that you might enjoy: http://blogs.worldbank.org/dev4peace/how-many-years-do-refugees-stay-exile",,,,Halostar,,,1510499294,t5_2sml9,t3_7cfn22,t3_7cfn22,1,1512561674,0,0,dppir7u,AskSocialScience,,,
[deleted],,,,[deleted],,,1510969831,t5_2sml9,t3_7djqng,t1_dpz4s5e,1,1512759934,0,0,dpzjgfq,AskSocialScience,,,
[removed],,,,[deleted],,,1510976127,t5_2sml9,t3_7djqng,t1_dpz8m0g,1,1512762377,0,0,dpznsog,AskSocialScience,,,
I'm surprised the rates have risen so much. A few years ago the 6 year graduation rate was in the high 40s for public private and for profit.,,,,4look4rd,,,1510983455,t5_2sml9,t3_7djqng,t1_dpzag9o,1,1512764843,0,0,dpzs4as,AskSocialScience,,,
[removed],,,,[deleted],,,1510999827,t5_2sml9,t3_79afrw,t3_79afrw,1,1512768717,0,0,dpzyktq,AskSocialScience,,,
[removed],,,,[deleted],,,1511000404,t5_2sml9,t3_79afrw,t1_dp0vxk9,1,1512768826,0,0,dpzyri5,AskSocialScience,,,
"Thank you, I'll check that out",,,,PuddingOfEarl,,,1511008388,t5_2sml9,t3_7d4ynf,t1_dpz0h75,1,1512770509,0,0,dq01h4p,AskSocialScience,,,
This post has been removed as this subreddit is not intended to provide personal advice or help with school work. Perhaps a sub like /r/AskAcademia could provide suggestions on how to proceed.,,,,MoralMidgetry,,,1511026748,t5_2sml9,t3_7ddjei,t3_7ddjei,1,1512777369,0,0,dq0deo2,AskSocialScience,,moderator,
This submission has been removed as it's not a social science question. Perhaps /r/HomeworkHelp could be of assistance.,,,,MoralMidgetry,,,1511026863,t5_2sml9,t3_7docw0,t3_7docw0,1,1512777417,0,0,dq0di46,AskSocialScience,,moderator,
"IMO those aren't even the most convincing arguments against universal free PSE.

[This paper is informative.](https://www.econstor.eu/bitstream/10419/21423/1/dp518.pdf)

Quote:

&gt; Gaps in educational attainment related to family background arise in many different environments including those with free tuition and no restrictions on college entry. This evidence points to the powerful role of the long-term factors that we have emphasized in this paper.

That is, making tuition free doesn't do much to push kids of low-income families into PSE.

(And this part is me editorializing) It's mostly just a subsidy for well-off families and students.",,,,HelloAnnyong,,,1511027993,t5_2sml9,t3_7djqng,t1_dpyraom,4,1512777966,0,0,dq0eg3j,AskSocialScience,,,
"I can provide you with evidence from the UK's experience of implementing tuition fees, it my not apply to all context but its an interesting case study. My information for this come from a paper title [The End of Free College in England: Implications for Quality, Enrolments, and Equity](http://www.nber.org/papers/w23888). An ungated PDF can be found [here](http://cep.lse.ac.uk/pubs/download/dp1501.pdf) and short a summary is [here.](http://cep.lse.ac.uk/pubs/download/cp503.pdf)

Originally university in the UK was free but the Labour government brought in tuition fees up to £3000 which was later increased to £9250 by the coalition government under Cameron.

The change was driven in part because the system was seen as regressive as the people that benefited most from it were the middle and upper class, it was also meant that as demand for workers with degrees rose politicians had to find more funding.
When no additional funding was forthcoming the end result was limiting places or limit the amount spent per student, neither of which are attractive proposals.

After charging for fees you ended up with

* More students enrolling in university (This might not have necessarily been caused by raises in fees but it certainly wasn't limited by it either)
* More funding per pupil
* A lowering of the social economic divide in university attendance

Its also important to look at how the fees where implemented, instead of paying upfront student take out a loan which is only repaid when they earn over a certain threshold. The system at the moment is a bit like a tax rather than a loan, in fact there's been talk about actually turning it into a tax. There are also grants to help poor student manage finance whilst studying away from home.

Having said all this it should be noted that raising tuition fees has been politically unpopular, so unpopular that when they were raised to £9250 there were riots in the streets. One of the reasons Corbyn did so well in the last general election was his promise to abolition tuition fees.

Its left a lot of people with the impression that they will be saddled with debt all their life that they will never pay off. This is absolutely true and part of it is by design as it means that the burden doesn't fall on less disadvantaged student. People also make arguments based on principle, believing that important public goods should be funded by government not by private individuals.",,,,ToughAsGrapes,,,1511042202,t5_2sml9,t3_7djqng,t3_7djqng,3,1512784428,0,0,dq0q044,AskSocialScience,,,
"The second point is quite arguble... The economic barrier is not the sole reason people doesn't go to college. Other factors play a role, like personal inclinations, social capital and cultural capital.
Moreover, this is annedoctical, but i noticed that nations offering free or low cost/heavily subsidized college education usually have quite a big sistem of ""entry barriers"" that avoid overcrowding, for example grade-based selection, closed number university courses, a good system of secondary, job-aimed education, but i have no data to prove my point. Just a personal observation.",,,,CaCO3isboring,,,1511044981,t5_2sml9,t3_7djqng,t1_dpyraom,3,1512785617,0,0,dq0s4bl,AskSocialScience,,,
[deleted],,,,[deleted],,,1510709358,t5_2sml9,t3_7cx05h,t3_7cx05h,1,1512652808,0,0,dpu35o2,AskSocialScience,,,
"The short answer is that there is no hard line in the sand. For political polling, the rule of thumb is generally a 95% confidence interval within 2-3% of the mean. So if the survey finds  50% of respondents are male, there is a 95% chance that the population is in the range of 49-51%.

If we assume that your coverage error is nil and that your no response error is also nil, then we can focus on sampling error. For a very large population size , your response rate would be about right for a 90% CI within 10% of the mean.  So for the example above, the population would be between 45-55% men. If the census data is in that range, then you can call it representative. It doesn’t mean that your survey measures are precise though. The caveat is the confidence interval.

The tricky thing is that a question of representation can be asked for every measurement in the survey. To may be representing  male/female well but not income distribution. That’s where  a stratified sample can be helpful.",,,,grindermonk,,,1510709751,t5_2sml9,t3_7cx27a,t1_dptrwej,2,1512652990,0,0,dpu3i4t,AskSocialScience,,,
"I should also add that with a response rate of less than 20%, I would also be very concerned about no response bias. Do you have any data On households that did not respond to compare with those that did? With weights you might be able to correct for some of that bias. Otherwise it’s a serious limitation on the inference you can make to the pivot population.",,,,grindermonk,,,1510709983,t5_2sml9,t3_7cx27a,t1_dptrwej,1,1512653090,0,0,dpu3pay,AskSocialScience,,,
[removed],,,,[deleted],,,1510715218,t5_2sml9,t3_7cywbh,t3_7cywbh,3,1512655516,0,0,dpu8iae,AskSocialScience,,,
"Despite all of its difficulties, the popular book ""Capital in the Twenty-First Century"" by Tomas Piketty largely explores the historical trends in inequality and advances a simple argument. Essentially, when the rate of return on investments outpaces economic growth, wealth will concentrate in the hands of the few. This is captured by his simplification of the cause of inequality (r &gt; g), where r is the rate of return and g is the growth rate. This exacerbates inequality because wealth, generally highly concentrated, will grow much more quickly than wages that go to a wider base of society. Here's a decent [summary](https://www.ft.com/content/0c6e9302-c3e2-11e3-a8e0-00144feabdc0) of the book.

Piketty's recommendation is to tax the wealth of the rich, therefore artifically lowering 'r' and then using those taxes to help boost 'g' with investments in human capital, infrastructure, and redistribution.

His analysis is problematic because he data is iffy, he doesn't directly support his main hypothesis, and many argue that he is underplaying the huge divergence in wages that we see in many globalized economies.

Another set of arguments focuses on the voting franchise and the fear of violence. This argument is probably best summarized by a very well known paper by economists Acemoglu and Robinson titled [Why Did the West Extend the Franchise? Democracy, Inequality, and Growth in Historical Perspective](https://scholar.harvard.edu/jrobinson/files/jr_west.pdf). Essentially, you can't just pay off the poor, and so you democratize and let more people enter politics as a commitment mechanism that you will continue to redistribute to the poor. They then show that extensions of the franchise lead to lower inequality.",,,,temecula_sunrise,,,1510739243,t5_2sml9,t3_7cmmd2,t3_7cmmd2,3,1512662864,0,0,dpuminr,AskSocialScience,,,
"I don't have an authoritative answer, but there's at least one [book](https://press.princeton.edu/titles/4600.html) (""Economics and Sociology Redefining Their Boundaries: Conversations with Economists and Sociologists"", which I bought used online but haven't yet read) dedicated to the subject.",,,,themightyteebs,,,1510739307,t5_2sml9,t3_7cywbh,t3_7cywbh,3,1512662876,0,0,dpumjk9,AskSocialScience,,,
"&gt; I need to understand Arendt's thoughts

All of them or on something in particular? [This](https://plato.stanford.edu/entries/arendt/) is a start.

&gt; contemporary relevance

Her essay *Truth and Politics* is a bit of a low hanging fruit if you want to relate her to current happenings.",,,,lebitso,,,1510751216,t5_2sml9,t3_7d3nzu,t3_7d3nzu,11,1512665945,0,0,dpurxro,AskSocialScience,,,
"Social stratification isn't limited to modern Western societies, if that is what you mean. Life chances are distributed differently in a range of socio-historical contexts.

edit: [Here](http://www.unibielefeld.de/soz/we/we3/Diewald/Gruskysocialkstrat.pdf) is a link

&gt;In all complex societies, the total stock of valued goods is distributed unequally, with the most
privileged individuals and families enjoying a disproportionate share of income, power, and
other valued resources. The term “stratification system” refers to the complex of social
institutions that gene rate observed inequalities of this sort. The key components of such systems
are (1) the institutional processes that define certain types of goods as valuable and desirable, (2)
the rules of allocation that distribute these goods across various positions in the **division of labor
(e.g., doctor, farmer, “housewife”)** and (3) the mobility mechanisms that link individuals to
positions and thereby generate unequal control over valued resources.

You should be able to figure it out from here.",,,,gnarwar,,,1510753206,t5_2sml9,t3_7crifo,t3_7crifo,4,1512666684,0,0,dput9u8,AskSocialScience,,,
"That interview was published in full in her book Crisis of the Republic which you can find [here.](http://docdro.id/nTvboBw)

There's also [The Hannah Arendt Center](http://hac.bard.edu) which has a ton of information. ",,,,fields,,,1510755671,t5_2sml9,t3_7d3nzu,t3_7d3nzu,3,1512667774,0,0,dpuv4po,AskSocialScience,,,
"dw the intellectual presses are reacting to recent Arendt demand

[this](https://www.the-tls.co.uk/articles/public/hannah-arendt-hierarchy-human-activity/)

[lots of articles here](https://lareviewofbooks.org/archive/advanced-search?state=everything&amp;keywords=arendt+articles)

",,,,mosestrod,,,1510762690,t5_2sml9,t3_7d3nzu,t3_7d3nzu,2,1512671656,0,0,dpv1reg,AskSocialScience,,,
"If you're in the UK, Radio 4's 'In Our Time' did a good primer, which is available as a podcast: http://www.bbc.co.uk/programmes/b08c2ljg
",,,,yoosanaim,,,1510764153,t5_2sml9,t3_7d3nzu,t3_7d3nzu,1,1512672507,0,0,dpv392s,AskSocialScience,,,
"Thanks for the reference! It seems like reading it would enhance my understanding of the intersection between the two fields. ",,,,BuildBetterWorld,,,1510769527,t5_2sml9,t3_7cywbh,t1_dpumjk9,2,1512675922,0,0,dpv8uv8,AskSocialScience,,,
"Thank you all so much for your comments and links people, I have a rough idea of things now. It's hard though, going back to pol philosophy, that too for such an unconventional thinker, after 4 years of having left Pol Sci for research in IR  ",,,,Rushdie1,,,1510775551,t5_2sml9,t3_7d3nzu,t3_7d3nzu,2,1512679598,0,0,dpvf3vy,AskSocialScience,,,
"Here's a defense of the importance of formal conceptual definitions generally:

&gt;Definitions must be carefully
designed to clearly represent the abstract concept. The
practice of using just common sense leads to imprecise
formal conceptual definitions that in turn lead to
ambiguous or vague measures and subsequently lead
to ‘bad’ theory that cannot be confirmed nor refuted.

Source: Wacker, J. G. (2004). A theory of formal conceptual definitions: developing theory-building measurement instruments. *Journal of Operations Management*, 22(6). P. 630.


**Me again** What you're really describing isn't so much a question about the necessity of the sociological definition of racism, it's about the use of formal definitions in general. In academic social science they matter **A LOT** because they determine what is in and out of bounds, and all of the good things the quote I cite above say.

In your day to day life is that particular definition of racism important? Maybe. Maybe not. But often you'll find that even if you think you have the 'colloquial' definition in mind, the person you're speaking with has something else entirely in mind.

In sum, definitions are critical, because they set the limits on the phenomena we're describing. After all, if something describes everything, it describes nothing.",,,,just_works_here,Public and International Affairs,,1510273780,t5_2sml9,t3_7bw9la,t3_7bw9la,3,1512480711,0,0,dpljxu3,AskSocialScience,,,polisci
"There's no such thing as ""the"" sociological definition of racism, so no, it's not necessary. Sociologists are interested in racism and thus need to define it to talk about it, and *those* definitions seem necessary or at least useful (because otherwise sociologists would have to talk around the term which would get clunky) but all sociologists do not get together and decide that racism means one thing, forever.

So for instance if you look at something like Winant's ""Race and Racism: Toward a Global Future,"" of course Winant needs a definition of racism to talk about racism. I mean, practically speaking, English is a language with enough words that he could just use euphemisms the entire time, but why would he do that? That's clunky!",,,,TychoCelchuuu,,,1510274899,t5_2sml9,t3_7bw9la,t3_7bw9la,3,1512481182,0,0,dplkuap,AskSocialScience,,,
[removed],,,,[deleted],,,1510277188,t5_2sml9,t3_7bugq0,t3_7bugq0,-9,1512482181,0,0,dplmojc,AskSocialScience,,,
"&gt; This might be more philosophy than psych

Whether or not people do engage in a behavior is firmly within psychology, and not philosophy. ",,,,ChiefWilliam,,,1510286319,t5_2sml9,t3_7bkw3q,t3_7bkw3q,2,1512486049,0,0,dplu9ad,AskSocialScience,,,
"&gt; whether there was some kind of metabolic path dependency

That could also be explained by habits they picked up while in poverty or things like gut microbiome.",,,,geak78,,,1510314117,t5_2sml9,t3_7bugq0,t1_dplbfh3,2,1512493012,0,0,dpm7ind,AskSocialScience,,,
Aren't richer people more likely to be gluttons and be able to purchase food?,,,,nascentt,,,1510317935,t5_2sml9,t3_7bugq0,t3_7bugq0,1,1512494064,0,0,dpm9agx,AskSocialScience,,,
Calories are cheap in developed countries. Healthy balanced meals tend to be more expensive than quick and easy calorically dense foods (case in point: the dollar menu at McDonald's),,,,ohnodapopo,,,1510321359,t5_2sml9,t3_7bugq0,t1_dpm9agx,3,1512495156,0,0,dpmbb86,AskSocialScience,,,
"http://journals.plos.org/plosmedicine/article?id=10.1371/journal.pmed.1002214

http://www.sciencedirect.com/science/article/pii/S0091743517303407

https://academic.oup.com/aje/article-abstract/185/9/765/3098976

http://www.sciencedirect.com/science/article/pii/S1043951X17300676

https://www.ncbi.nlm.nih.gov/pubmed/24967954",,,,Shazbot_Nanu,,,1510321388,t5_2sml9,t3_7bugq0,t1_dplbfh3,3,1512495166,0,0,dpmbbx3,AskSocialScience,,,
"Take a look at this basic video about time perception in different cultures, and you might find yourself walking back any ideas that talking speed is correlated with many of the things you mention: https://www.youtube.com/watch?v=A3oIiH7BLmg

In other words, by simply saying that you speak quickly, you've already told us where you are from.",,,,midlifefuckingcrisis,,,1510323837,t5_2sml9,t3_7bzqi8,t3_7bzqi8,4,1512496187,0,0,dpmd2e0,AskSocialScience,,,
"This is not my area of research, but my sense is that this work relies on these large, difficult to collect longitudinal datasets, and they may not yet have the detail that allows them to ask questions about all these possible mechanisms (behavioral, microbiomic, metabolic, epigenetic, ...etc?). But I don't know these datasets. Maybe I didn't hit all the most relevant studies in my search, but it does seem like your question is rather low-hanging fruit methodologically, where you look at the effect of income as a time-varying covariate (which surely at least one of these datasets has at sufficient resolution) and then at possible interactions with baseline (childhood) SES factors. ",,,,Shazbot_Nanu,,,1510324878,t5_2sml9,t3_7bugq0,t1_dplbfh3,2,1512496657,0,0,dpmdvfh,AskSocialScience,,,
Thank you so much!,,,,atb25,,,1510325128,t5_2sml9,t3_7bugq0,t1_dpmbbx3,2,1512496784,0,0,dpme2ih,AskSocialScience,,,
[removed],,,,[deleted],,,1510330028,t5_2sml9,t3_7bzzug,t3_7bzzug,-19,1512499253,0,0,dpmidv9,AskSocialScience,,,
"Hopefully, someone who's more knowledgeable about this comes along since this isn't my area but I remember it being mentioned in several classes that their brain chemistry and functioning changes when they aren't in their ""real"" personality.

This article isn't solely about DID but does have some information on it.
https://www.ncbi.nlm.nih.gov/pmc/articles/PMC5283511/

*Forgot to mention that to determine this they would use something like a PET or fMRI to measure brain activity.
https://www.ncbi.nlm.nih.gov/pubmed/17008145

http://journals.plos.org/plosone/article?id=10.1371/journal.pone.0098795",,,,the_Pwny_Xpress,,,1510330689,t5_2sml9,t3_7bzzug,t3_7bzzug,12,1512499600,0,0,dpmj0a1,AskSocialScience,,,
"Interesting, though it doesn't mirror my own experience at all. People with money tend to be big, some I know have grout.

Whereas homeless and poor people are always malnourished and skinny.",,,,nascentt,,,1510330867,t5_2sml9,t3_7bugq0,t1_dpmbb86,0,1512499693,0,0,dpmj6fi,AskSocialScience,,,
"The relationship is not cut and dry, though trends emerge. this data is a few years old but has some interesting insight. https://www.theatlantic.com/business/archive/2013/11/the-messy-messy-relationship-between-income-and-race-and-obesity/281434/",,,,ohnodapopo,,,1510333926,t5_2sml9,t3_7bugq0,t1_dpmj6fi,2,1512501467,0,0,dpmm3jr,AskSocialScience,,,
