body,score_hidden,archived,name,author,author_flair_text,downs,created_utc,subreddit_id,link_id,parent_id,score,retrieved_on,controversiality,gilded,id,subreddit,ups,distinguished,author_flair_css_class
[removed],,,,[deleted],,,1511310387,t5_2sml9,t3_7einr4,t3_7einr4,1,1512884445,0,0,dq61eti,AskSocialScience,,,
"I’m not sure about industrial societies (it’s a hard thing to measure), but sexual morés among pre-industrial societies varied widely, with some (especially those in the Arab world) being very restrictive and others (especially those in the Pacific) being very permissive. *Patterns of Sexual Behavior*, from 1951, seeks to study the topic somewhat systematically. [Wiki](https://en.wikipedia.org/wiki/Patterns_of_Sexual_Behavior). It’s obviously dated, but I don’t know a more recent text that tries to approach the problem as systematically. 

Regional cultures switch over time. Samoa, which was so permissive when Margaret Mead studied the region in the 1920’s, became much more conservative as it developed, mostly under the influence of austere forms of Christianity. This change helps explain one of the biggest anthropological controvery’s of the 1980’s: Derek Freeman’s sustained criticism of Mead and her *Coming of Age in Samoa*. The controversy is extended, you can see a short version on Freeman’s Wikipedia page and a longer version on the *Coming of Age in Samoa* Wikipedia page. 

From what I’ve seen, however, this region is an outlier and most areas sexually liberalize (to some degree) as they industrialize and post-industrialize, though it’s not necessarily a straight line and there may be moment where places do become more restrictive, at least for periods of time (often enforcing norms that were once for the middle class on lower class individuals, for example). ",,,,yodatsracist,Sociology of Religion,,1511314079,t5_2sml9,t3_7eh9h1,t3_7eh9h1,9,1512885962,0,0,dq64e2i,AskSocialScience,,,soc
"It's not that the words themselves are bad but rather that they symbolize something considered taboo — and what's considered taboo varies wildly between cultures.

Wikipedia has a decent article on it (e.g. see the section on Steven Pinker): https://en.wikipedia.org/wiki/Profanity Also, you should look up some of Steven Pinker's talks on swearing  on YouTube. They are hilarious.

Digging around a little in /r/linguistics yielded these that may also be of interest:

 * https://www.reddit.com/r/linguistics/comments/47zrcr
 * https://www.reddit.com/r/linguistics/comments/52g42v",,,,lillesvin,Cognitive Linguistics | Phonetics,,1511314563,t5_2sml9,t3_7emf3v,t3_7emf3v,14,1512886157,0,0,dq64s2e,AskSocialScience,,,ling
"If it's about what they symbolize rather than the word itself, then why for example is cunt a bad word but vagina is not?",,,,wayfaring_stranger_,,,1511321577,t5_2sml9,t3_7emf3v,t1_dq64s2e,8,1512888996,0,0,dq6acpu,AskSocialScience,,,
[Schism?](http://onlinelibrary.wiley.com/doi/10.1111/j.1751-9004.2007.00073.x/abstract),,,,strangenchanted,,,1511323342,t5_2sml9,t3_7enipy,t3_7enipy,2,1512889648,0,0,dq6bo3q,AskSocialScience,,,
The proper meaning of cunt is a raped vagina. I would assume thats why.,,,,justa_fella,,,1511325903,t5_2sml9,t3_7emf3v,t1_dq6acpu,-15,1512890544,0,0,dq6dgd4,AskSocialScience,,,
"My M-I-L has reached Samuel L. Jackson levels of saying Motherfucker  45-50 yrs ago. I’m pretty sure she taught Samuel L. Jackson the proper use.  I don’t know how to link videos, but Bernie Mackie has a hilarious  part about the use of Motherfucker in “The Original King’s of Comedy”. ",,,,Kidminder,,,1511332270,t5_2sml9,t3_7emf3v,t1_dq64s2e,-4,1512892534,0,0,dq6h8d3,AskSocialScience,,,
"I think a schism is definitely part of the ... whatever the ""bigger"" picture is, if there is such a thing. Take Reddit e.g., all the gaming subs that have splintered over time for one reason or another. I think some of those are definitely the result of a sub/counter culture upset with the status quo leaving one sub to create their own with their own set of rules. 

It seems like there's a broader trend that happens over and over, almost like an accumulation of negativity building pressure or something that generally results in a number of changes, a schism being one of them, until the responsible parties are gone and most, but not all, of their influence recedes. It may be anecdotal, but it seems like whatever influence remains has an effect on the process, reducing the time between each cycle proportional to how much negative sentiment remains in the community or is incorporated by the other members. That's the main reason I'm looking for any information on this is to try and have a better understanding of how this happens and to hopefully find some literature or research that might include some sort of model for this behavior.

The only other thing I've found so far that talks about the sort of broader trend in behavior is this article posted by someone on BuzzFeed. Just a quick disclaimer, I'm not supporting the political opinion in this article and if I could, I'd much rather have an objective example to provide, but this article talking about ""mod drama"" as she calls it, and the phases online communities go through is almost identical to what I've seen. I think she even mentions a schism in one part. 

https://www.buzzfeed.com/katienotopoulos/the-alt-rights-meltdown-is-just-like-any-other-message-board
",,,,fhayde,,,1511332594,t5_2sml9,t3_7enipy,t1_dq6bo3q,1,1512892621,0,0,dq6heca,AskSocialScience,,,
Vagina is a pretty neutral term whereas cunt is a derogatory term for the same thing and also widely used to refer to people and certain properties of them. See also https://www.etymonline.com/word/cunt,,,,lillesvin,Cognitive Linguistics | Phonetics,,1511334000,t5_2sml9,t3_7emf3v,t1_dq6acpu,3,1512892977,0,0,dq6i30o,AskSocialScience,,,ling
Source? I can't find any mention of that here: https://www.etymonline.com/word/cunt,,,,lillesvin,Cognitive Linguistics | Phonetics,,1511334136,t5_2sml9,t3_7emf3v,t1_dq6dgd4,3,1512893012,0,0,dq6i5ek,AskSocialScience,,,ling
"http://gulfmigration.eu/uae-average-normal-hours-of-work-actual-hours-of-work-wages-and-earnings-by-nationality-group-2008/

This is one data point, which suggests that GCC average of actual hours worked is the same as European countries, while non-GCC Arab countries log more actual hours of work than Europeans on average. 

There is the caveat that some of those hours are migrant workers (many of them non-Arab) in slave or near-slave conditions, which would likely bring up the average. But since UAE (traditionally one of major slave labor importers) lists *fewer* actual hours worked than both of the above, this might not be such a big factor (it's likely that much of the slave labor happens off the clock, or even off the books entirely). ",,,,vistandsforwaifu,,,1511334496,t5_2sml9,t3_7einr4,t3_7einr4,2,1512893098,0,0,dq6ibkv,AskSocialScience,,,
[removed],,,,[deleted],,,1511334638,t5_2sml9,t3_7enkeu,t3_7enkeu,3,1512893130,0,0,dq6idyc,AskSocialScience,,,
[removed],,,,[deleted],,,1511337595,t5_2sml9,t3_7enkeu,t3_7enkeu,18,1512893791,0,0,dq6jpbo,AskSocialScience,,,
You should read the book *Nisa: life of a kung woman* about the history of well a !Kung women from Southern Africa.,,,,2nd_Can_Div,,,1511346106,t5_2sml9,t3_7eh9h1,t3_7eh9h1,3,1512895493,0,0,dq6n13x,AskSocialScience,,,
"Your title is a little confusing. The social construction of facts implies a version of ""strong constructivism,"" which is a theory that argues that facts are completely socially constructed, meaning they have no correspondence to reality at all. You are not talking about the ""social construction"" of facts, but more about the construction of the presentation of facts.

For that, I would tell you to check out the [framing effect](https://en.wikipedia.org/wiki/Framing_effect_(psychology)), which is a big part of behavioural economics and psychology. The book [Thinking Fast and Slow](https://books.google.nl/books?redir_esc=y&amp;id=ZuKTvERuPG8C&amp;q=framing#v=snippet&amp;q=framing&amp;f=false) by Kahnemann has an abundance of examples.

As for your example, its probably better to go with ""30% believe it should be legal,"" because that sounds like a lot of people support it. ""70% believe it should be illegal"" makes it sound like there is a big opposition. But I would not just look at polling, but also at scientific findings. For example, and this is modelled on Kahneman and Tversky's work, ""in 90% of cases, marijuana has no negative side effects"" will likely lead to more support than ""in 10% of cases, marijuana has negative side effects"" even though they highlight the same underlying fact (these numbers are made up by the way).

 ",,,,ManWithAMasterplan,,,1511349129,t5_2sml9,t3_7ef7cc,t3_7ef7cc,1,1512896078,0,0,dq6o5ad,AskSocialScience,,,
[removed],,,,[deleted],,,1511349756,t5_2sml9,t3_7enkeu,t3_7enkeu,1,1512896199,0,0,dq6oe5a,AskSocialScience,,,
"I can see that. Thanks for the explanation. What about a word like shit vs. poop then? What makes shit bad but poop ok?   
Similarly, what makes it ok to use curse word substitutions that essentially mean the same things? Like freaking vs. fucking or f you vs. fuck you. ",,,,wayfaring_stranger_,,,1511350958,t5_2sml9,t3_7emf3v,t1_dq6i30o,1,1512896451,0,0,dq6ovnh,AskSocialScience,,,
[removed],,,,[deleted],,,1511351077,t5_2sml9,t3_7enkeu,t1_dq6jpbo,8,1512896477,0,0,dq6oxim,AskSocialScience,,,
"If you are really interested there is a great book called “What the F” by Benjamin Bergen. It is written for a lay audience but is a great overview of swearing, the neuroscience, the history, and what it tells us about our minds.",,,,CupBeEmpty,,,1511354892,t5_2sml9,t3_7emf3v,t3_7emf3v,3,1512897420,0,0,dq6qr2a,AskSocialScience,,,
"Yeah, I've read some Ugandan fairytales and sexual motives are almost in all of them. You're right it might be better to narrow it down to Western and Eastern Europe.",,,,kyrgyzstanec,,,1511360593,t5_2sml9,t3_7eh9h1,t1_dq6n13x,1,1512899320,0,0,dq6uggq,AskSocialScience,,,
[removed],,,,[deleted],,,1511363502,t5_2sml9,t3_7enkeu,t3_7enkeu,-1,1512900501,0,0,dq6wuca,AskSocialScience,,,
[removed],,,,[deleted],,,1511368413,t5_2sml9,t3_7e3ao3,t3_7e3ao3,1,1512902793,0,0,dq71eu8,AskSocialScience,,,
"I can't seem to find a link to the full video anywhere, but there's a segment of Inside the Actors Studio where James Lipton interviews Robin Williams. It's unforgettable in a lot of ways, but I'll always remember his favorite and least favorite curse words.

His favorite was ""pussy,"" because it's so warm and inviting. His least favorite is ""cunt,"" because it takes something so good and destroys it. I first saw that as a teenager, and the power of word choice and intent have stuck with me in part because of him.

It seems like a lot of curse/swear words are taking something not just banal, but something that could be positive, and using them in a negative way. Obviously I'm speculating, but we do have many examples of English words for medical diagnoses becoming distorted into slurs.",,,,Thanatology,,,1511369001,t5_2sml9,t3_7emf3v,t1_dq6i30o,2,1512903075,0,0,dq71zfk,AskSocialScience,,,
"&gt;https://www.reddit.com/r/linguistics/comments/52g42v

Say, would you happen to be familiar with the use of 'register' in this thread? I haven't seen it before, and I can't find it elaborated on anywhere.",,,,nukefudge,,,1511374500,t5_2sml9,t3_7emf3v,t1_dq64s2e,1,1512905830,0,0,dq77axj,AskSocialScience,,,
"While I am not qualified to answer your question, it reminded me of a conversation between Hutcheon and Valdés (1998) I was reading recently. From Hutcheon:

&gt;Nostalgia, in fact, may depend precisely on the irrecoverable nature of the past for its
emotional impact and appeal. It is the very pastness of the past, its inaccessibility, that likely
accounts for a large part of nostalgia's power—for both conservatives and radicals alike. This
is rarely the past as actually experienced, of course; it is the past as imagined, as idealized
through memory and desire. In this sense, however, nostalgia is less about the past than about
the present. It operates through what Mikhail Bakhtin called an ""historical inversion"" (1981,
147): the ideal that is not being lived now is projected into the past. It is ""memorialized"" as
past, crystallized into precious moments selected by memory, but also by forgetting, and by
desire's distortions and reorganizations (Phillips 1985, 66).

[Hutcheon, L. and Valdés, M.J., 1998. Irony, nostalgia, and the postmodern: a dialogue. Poligrafías. Revista de Teoría Literaria y Literatura comparada, \(3\).](http://www.lpimentel.filos.unam.mx/sites/default/files/poligrafias/3/02-hutcheon-valdes.pdf) - Here's a PDF of the article.

There are a lot of freely available articles that might help you out, if you search for ""nostalgia"" on Google Scholar:

https://scholar.google.ca/scholar?hl=en&amp;as_sdt=0%2C5&amp;q=nostalgia&amp;btnG=",,,,lazarescu,,,1511374912,t5_2sml9,t3_7enkeu,t3_7enkeu,4,1512906033,0,0,dq77pa1,AskSocialScience,,,
"I'm not an expert on the specific theme (i'm studying for my master in sociology), but i think network analysis could be an useful tool.  
Basically network analysis allows you to examinate a set of actors and their interaction through the use of graphs and statistical methods. Each actor is represented by a ""node"" and interaction between them constitutes a ""tie"".   There are ways to take in account attributes of the actor, of course. Ties are natural paths for resources - including information - that flow through the system, and they can have a great variety of attributes attached to them, as ""strength"", or carry capacity, or frequency of contact, just to make a few examples, and can be symmetric or directed.  
A (social) network analysis approach can help to identify the shortest/best path of information, as well as the crucial points that guarantee connection within the network or across the whole network.  
Moreover, actors can be anything from people to organizations to states.  
It is a fascinating methodology, and there is a book available for free on the internet, that also my professor used. It is called ""introduction to social network methods"", by Hanneman and Riddle. Try to give it a look and see if it fits your answer. 
I hope that someone more knowledgeable than me will come to reply to your question ayway",,,,CaCO3isboring,,,1511374975,t5_2sml9,t3_7es5ex,t3_7es5ex,7,1512906061,0,0,dq77rdv,AskSocialScience,,,
"A fair amount of it can be ascribed to ""[Generational Progression](https://scholar.colorado.edu/cgi/viewcontent.cgi?referer=https://www.google.com/&amp;httpsredir=1&amp;article=2273&amp;context=honr_theses)"", because each generation sees
progression and novelties that the ones before it have never seen. Older generations will take new things that are seen as ""good"" in stride (microwave ovens, once upon a time), while noticing the things that are new and ""bad"" to them (put that damn phone down at the table). 

And, it's also simple Human Nature. By the time a person has reached the age of being thought of as an ""older generation"", they have matured and in many ways forgotten their own youthful behavior.  

Here's an enlightening quote from the [same study](https://scholar.colorado.edu/cgi/viewcontent.cgi?referer=https://www.google.com/&amp;httpsredir=1&amp;article=2273&amp;context=honr_theses):

“The children now love luxury; they have bad manners, contempt for authority; they show disrespect for elders and love chatter in place of exercise. Children are now tyrants, not the servants of their households. They no longer rise when elders enter the room. They contradict their parents, chatter before company, gobble up dainties at the table, cross their legs, and tyrannize their teachers.""

Plato, 428 BC

...so as can be seen, the old criticizing the young isn't a modern phenomenon. 
",,,,AspireAgain,,,1511379072,t5_2sml9,t3_7enkeu,t3_7enkeu,5,1512908014,0,0,dq7blou,AskSocialScience,,,
"Corruption would be measured by the purpose of some sort of ritual. For example, the corruption in terms of marriages would be measured in divorce rates, at least in part.

To use my main concern, the corruption of guanxi would be measured in terms of businesses practices favoring giving power to family members at the expense of those the family member has control over (perhaps in terms of bolstering personal wealth while at the same time denying employee benefits, abusive practices by the appointed family member to the employees, etc.). In turn, these might be measured by employee experiences vs. family experiences, so perhaps it would be best to survey employees on the perception of corrupt practices.

Of course, these are only a few examples, and they may not be what sociologists generally think of. I know it's a very complex situation, especially in terms of measuring corruption, hence I wanted to ask in order to get some bearings straight.",,,,cronos844,,,1511380797,t5_2sml9,t3_7e498a,t1_dq2rz4h,2,1512908809,0,0,dq7d6nw,AskSocialScience,,,
"&gt; still don't know what you mean by that or what the relationship of ""ritual"" is to ""tradition""

I'm assuming, in my question, that ritual arises from tradition. For example, in China the contemporary practice of guanxi is a ritual that began when Confucianism, and therefore family favoritism, became dominant in China. The Confucian view is that such a practice is meant to bolster social cohesion, such that family ties are strengthened, and some other things that Confucians count as ""good.""

So, in general terms, a tradition gives meaning to some practice that in terms becomes widespread throughout a certain society, this is what a ritual is. Tradition can be defined in terms of religious beliefs (christianity being the traditional religion of the west), cultural beliefs (such as marriage), etc. My question is more China centric, so most of what I mean by tradition is Confucian beliefs and practices.

Ritual would be a set of practices that arise out of these beliefs, such as marriage (which arises out of the belief that solidifying family ties, having children, is important (in confucianism this is because such things make one more socially minded)).

Corruption would be practicing a ritual without the intended effects. So a marriage would be take place, even though the couple may plan on divorcing soon after, and that would count as a corruption of marriage. Of course, this goes into some philosophy stuff, and what kind of standard one has does go into defining corruption.

Perhaps a better question, and one that I would need to look into to help me understand my own question is: How do people generally look at as corruption in China, and what do sociologists do in terms of looking at China?",,,,cronos844,,,1511381935,t5_2sml9,t3_7e498a,t1_dq393g7,2,1512909327,0,0,dq7e7qp,AskSocialScience,,,
"In linguistics ""register"" usually means ""jargon"" or ""sociolect"", i.e. a variant associated with a specific profession, task or social group, could be medical jargon, programming jargon, hip-hop/rap slang, or — in this case — swearing. (For further elaboration https://en.wikipedia.org/wiki/Register_%28sociolinguistics%29 is pretty good.)",,,,lillesvin,Cognitive Linguistics | Phonetics,,1511382191,t5_2sml9,t3_7emf3v,t1_dq77axj,2,1512909444,0,0,dq7eg10,AskSocialScience,,,ling
"Thanks!

Hey wait, you're Danish? Me too! What's the Danish term for it? I was curious about that as well :D",,,,nukefudge,,,1511383084,t5_2sml9,t3_7emf3v,t1_dq7eg10,1,1512909859,0,0,dq7f9nr,AskSocialScience,,,
"Information science is what you're searching for.

Information science encompasses more than what you describe, but it also specifically deals with managing information in organisations. How can information be passed in the right format at the right time and to the right person?

Wait, wikipedia describes it much better (emphasis is mine):

&gt; Information science is a field primarily concerned with the analysis, collection, classification, manipulation, storage, *retrieval, movement,* dissemination, and protection of information. Practitioners within and outside the field study application and usage of knowledge in organizations along with the interaction between people, organizations, and any existing information systems with the aim of creating, replacing, improving, or understanding information systems. Historically, information science is associated with computer science, library science, and telecommunications. However, information science also incorporates aspects of diverse fields such as archival science, cognitive science, commerce, *law,* museology, *management,* mathematics, philosophy, *public policy,* and social sciences.

https://en.wikipedia.org/wiki/Information_science

I did a minor from the Information Sciences bachelor. The courses were called things like: Organisations &amp; IT; Strategic Management &amp; IT and; Information Systems. I combined public governance and organisational sciences in my bachelor and specifically chose these organisation-related Information Science courses to compliment my knowledge on the IT side. That information science bachelor had lots more courses like webdesign, data modeling, multiple programming courses and also courses that dealt with cognitive and interaction topics. Information science really deals with how humans (and organisations) deal with information and interact with information devices. Even a bit of psychology is touched upon.

So, concluding. Information science is quite broad, but I think it encompasses what you are looking for.

If you're specifically looking into the flow of information in political and bureaucratic organisations, I suggest you look for studies that combine government or political science with information science.",,,,Captain_Jack_Falcon,,,1511387321,t5_2sml9,t3_7es5ex,t3_7es5ex,16,1512911896,0,0,dq7j5lb,AskSocialScience,,,
"Haha, yeah, I am! :D In Danish it's usually also called ""[register](http://denstoredanske.dk/Sprog,_religion_og_filosofi/Sprog/Sprogvidenskab,_overbegreber/register)"" or ""sociolekt"". (They're not synonymous but they are very related and can overlap.)",,,,lillesvin,Cognitive Linguistics | Phonetics,,1511387679,t5_2sml9,t3_7emf3v,t1_dq7f9nr,1,1512912061,0,0,dq7jh4b,AskSocialScience,,,ling
"I'm interested in finding textbooks about the history of psychology. However, I find that most books either cover only the modern history of psychology or are written in a non-scientific style. Any suggestions on good textbooks?",,,,2017psych,,,1510014194,t5_2sml9,t3_79nwuy,t3_79nwuy,1,1512373911,0,0,dpg9494,AskSocialScience,,,
Sam Gosling,,,,morpheusx66,,,1510015737,t5_2sml9,t3_7b079b,t1_dpg52cz,1,1512374596,0,0,dpgadhy,AskSocialScience,,,
Thanks!,,,,dewarr,,,1510016169,t5_2sml9,t3_7b079b,t1_dpgadhy,2,1512374810,0,0,dpgaqau,AskSocialScience,,,
[removed],,,,[deleted],,,1510017202,t5_2sml9,t3_7b7xe8,t3_7b7xe8,3,1512375261,1,0,dpgbkhr,AskSocialScience,,,
[removed],,,,[deleted],,,1510017457,t5_2sml9,t3_7b7xe8,t1_dpgbkhr,5,1512375374,1,0,dpgbs0n,AskSocialScience,,,
[removed],,,,[deleted],,,1510017504,t5_2sml9,t3_7b7xe8,t1_dpg56no,0,1512375395,1,0,dpgbtd8,AskSocialScience,,,
"Probably downvotes because it’s less science, more anecdotal. Also, it doesn’t tell us *why* shops are like this, which is what OP wanted to know. ",,,,Matti_Matti_Matti,,,1510017544,t5_2sml9,t3_7b7xe8,t1_dpg56no,9,1512375413,0,0,dpgbum3,AskSocialScience,,,
[removed],,,,[deleted],,,1510017944,t5_2sml9,t3_7b7xe8,t1_dpgbum3,-1,1512375586,1,0,dpgc6ku,AskSocialScience,,,
[removed],,,,[deleted],,,1510018125,t5_2sml9,t3_7b7xe8,t1_dpgbtd8,1,1512375665,1,0,dpgcc3e,AskSocialScience,,,
[removed],,,,[deleted],,,1510018448,t5_2sml9,t3_7b7xe8,t3_7b7xe8,8,1512375808,0,0,dpgcm14,AskSocialScience,,,
[removed],,,,[deleted],,,1510019563,t5_2sml9,t3_7b9ssp,t3_7b9ssp,3,1512376325,0,0,dpgdkih,AskSocialScience,,,
"We can speculate on what this gift implies about the social dynamics of your relationship, but we are not good on microscopes sorry. Maybe try /r/askscientists",,,,VincentStaples,,,1510019679,t5_2sml9,t3_7b7qvi,t3_7b7qvi,2,1512376375,0,0,dpgdo5z,AskSocialScience,,,
[removed],,,,[deleted],,,1510020045,t5_2sml9,t3_7b7xe8,t1_dpgbs0n,0,1512376541,1,0,dpgdzm2,AskSocialScience,,,
Maybe a cultural philosopher?,,,,morpheusx66,,,1510020877,t5_2sml9,t3_7b9ssp,t1_dpgdkih,0,1512376955,0,0,dpgepn6,AskSocialScience,,,
"He proposes causal explanations, he just doesn't really provide the evidence to back them. Which, given the subject matter, is fair enough. It's just... different. Lots of anthropology is filling in blanks around facts, which is fine, it's just that his work is more blank than fact if you get what I mean.",,,,VincentStaples,,,1510021029,t5_2sml9,t3_7b9ssp,t1_dpgepn6,6,1512377034,0,0,dpgeuji,AskSocialScience,,,
