body,score_hidden,archived,name,author,author_flair_text,downs,created_utc,subreddit_id,link_id,parent_id,score,retrieved_on,controversiality,gilded,id,subreddit,ups,distinguished,author_flair_css_class
"Most of what I've come across suggests [income inequality is the effect of property inheritance](http://tuvalu.santafe.edu/~bowles/2002JEP.pdf). In really big picture terms you could argue that without a [coevolution of private property you don't get a transition to agriculture](http://www.pnas.org/content/110/22/8830.full). You also don't have the formation of [states without agriculture](https://yalebooks.yale.edu/book/9780300182910/against-grain). So if you buy into the understanding of history and you consider states and agriculture good things then maybe there's a benefit. It's not a direct benefit from inequality. Rather inequality is an emergent feature of the institutional norms and rules of these kinds of societies. 

When we look at contemporary evidence generally speaking [hunter gather societies and horticultural societies don't have large inequalities](https://faculty.washington.edu/easmith/Smith_etal_2010-CA_Concl.pdf). What's interesting is looking at hunter gather societies that do have large inequalities, such as the St'at'imc or agricultural societies that don't have large inequalities such as the (post-great Law of Peace / pre Beaver Wars) Haudenosaunee (see Graeber's Debt for a possible explanation for this). What are the institutional differences? It's also interesting to reverse the question and consider in a state agriculture society what institutional forms would result in lower levels of inequality (hint: they have high levels of redistribution)? Samuel Bowles (cited above) makes the argument that internet culture and open source has many resemblances to hunter gather social organisation. I don't completely [buy it but it's an interesting argument](https://www.youtube.com/watch?v=UtmJ58S-dkE). ",,,,Erinaceous,,,1510110057,t5_2sml9,t3_7befi4,t3_7befi4,18,1512414713,0,0,dpi97ij,AskSocialScience,,,
"OK so, the problem is that there's no way to fit all the info into a sub-reddit post, which really requires its own book (or stack of books) because he is literally covering ALL of human history. So I'll list these objections boiled down to their very basic points.

-Technology (Guns and steel): Diamond makes it seem like the Europeans came in and just steamrolled the Native Americans, specifically because of the items mentioned in the title. With guns and steel, it was not actually clear that these were everywhere superior enough to be the decisive factor. Early guns were in fact pretty inaccurate and prone to breaking, plus you need a constant supply of gunpowder. Secondly, Native Americans widely adopted guns when it became advantageous to do so. Europeans often traded or simply provided guns to their native allies. Similarly with steel, the Europeans themselves frequently abandoned it when it was disadvantageous as with the Spanish who adopted Inca cloth armor. Basically, Diamond has a Civ tech-tree view of technology. See, e.g.,

[Thundersticks](https://earlyamericanists.com/2017/03/03/guest-review-thundersticks-firearms-and-the-violent-transformation-of-native-america/)

[AH thread on Native American resistance](https://www.reddit.com/r/AskHistorians/comments/4evhja/native_american_revolt_rebellion_and_resistance/)

[AH thread on tech in general](https://www.reddit.com/r/AskHistorians/comments/1aggse/the_native_americans_and_several_other_cultures/c8x977d/)

[BH thread on Cajamarca](https://www.reddit.com/r/badhistory/comments/2bv2yf/guns_germs_and_steel_chapter_3_collision_at/)

-Germs: Now this is the most realistic point to me at least because the population collapse in the Americas was absolutely devastating and very clearly linked to European disease. However, Europeans were still largely outnumbered early in the conquest despite the disease and it is clear that disease affected areas differentially. Paleopathology is very far from what I know, though, so I'll just mention that a recent revisionist book [Beyond Germs](https://muse.jhu.edu/book/41572) has been published on this.

-Agency: The issue is not whether one or another military leader led the armies or something like that. There are 2 points. 1. What side, or whether, certain Native American groups chose to fight on. Outnumbered and without a clear advantage in technology (or where Natives had adopted the very same technology) in many places, the Europeans had to rely on native allies. Diamond ignores this when it was frequently the decisive military factor. 2. Why the Europeans? Diamond seems to assume that whenever a society gets more advanced tech, it will inevitably seek to expand outward without restraint. So he has to explain this by saying that countries like China lost their edge because of geographical factors, but Blaut argues this misrepresents the geography of Europe vs. China.",,,,Snugglerific,,,1510130285,t5_2sml9,t3_7b9ssp,t1_dpi26cs,1,1512421812,0,0,dpil3vy,AskSocialScience,,,
"It depends on the sources of inequality. A lot of inequality in developing countries is due to state capture and excessive rent seeking. This means you have inequality, without growth or efficiency gains. So there's really no upside in those cases. However, inequality is also a side effect of market reforms and creating incentives for economic growth, especially in developing economies.

Lets take a look at China. Here is a [graph](http://www.worldbank.org/content/dam/Worldbank/Highlights%20&amp;%20Features/Poverty/ChinaGini.jpg) with the trend in the GINI-coefficient over time. It has clearly increased. Why? Prior to the reforms in the 1980s, its agricultural sector was collectivised. This meant that all farmers got similar compensation, unrelated to their productivity. So there was very little incentive for innovation or productivity gains. Everybody was equal, but everybody was poor. After the agricultural reforms, farmers were allowed to keep some of their surplus. This meant that productive farmers became richer. Instead of just having poor farmers, you now had rich farmers *and* poor farmers. Economic inequality started to grow. But this inequality was caused by incentives to be productive and indeed lead to a surge in productivity growth. These agricultural reforms often seen as one of the major causes of Chinese take off, even though they lead to inequality. This rippled out to the rest of the economy; entrepreneurs were allowed to keep their surplus, which created an incentive for them to innovate and grow the overall economy. It can be better for some people to get rich first, and to have inequality, then for everybody to be poor but equal.

It is important however, to distinguish productive and unproductive drivers of inequality. Even in developed countries, inequality creates incentives to innovate and be productive. One of the reasons why Bill Gates and Steve Jobs were successful is because they created products that consumers wanted. Why not reward them for those efforts? This is also known as [Schumpterian rent.](https://en.wikipedia.org/wiki/Schumpeterian_rent) However, the same Bill Gates then likely abused his monopoly position to limit competition. Processes like this increase inequality (because competition would reduce Microstoft's rents) without leading to a positive outcomes (innovation). Similarly, and this is what a lot of the research you cite in your original post points towards, excessive inequality might be self-perpetuating. Then the rich get richer, not because they are more productive or more innovative, but simply because they were rich in the first place.

Edit: As always, its good to think about this marginally. Inequality by itself is not bad, but on the margins, most countries probably have inequality that's too high. 
",,,,ManWithAMasterplan,,,1510135743,t5_2sml9,t3_7befi4,t3_7befi4,4,1512422915,0,0,dpin2kt,AskSocialScience,,,
"There are bound to be lists , like [this one from a Harvard symposium on social sciences](https://sites.fas.harvard.edu/~socsci/Documents/HardProbsSocSciSummaryResultsandPollText_31March2011.pdf), but I'm unsure whether general lists they gotten much traction in sociology. Following is a guess about the reasons as someone with a master's in sociology.

Sociological questions are less about the ""big unknown"" and more about refinement because people have prior knowledge about their lives. In other words, we have fewer questions where the answer truly seems unsolvable for long enough to be widely recognized as an open question.

Another reason for lack of lists is that they might seem unimportant when every empirical answer is doomed to change, both because of local differences and because people change their behaviour after reflecting on the answers. Results from earlier times, other countries or circles of life are useful as hypotheses and for comparison but you'd still need to research the same question locally to know what parts of the answers were applicable. This is in contrast to fields where everyone is basically studying the same topics with single/global answers (ie. questions about natural phenomena).",,,,Jiippa,,,1510135802,t5_2sml9,t3_7b0aur,t3_7b0aur,1,1512422970,0,0,dpin3ba,AskSocialScience,,,
"Can you give an example of what you mean?

People donate anonymously all the time. Is that an example?",,,,Fibonacci35813,Social Psychology &amp; Consumer Behavior,,1510150658,t5_2sml9,t3_7bkw3q,t3_7bkw3q,9,1512427475,0,0,dpiuoer,AskSocialScience,,,psych
I dont think so. You could argue that it makes you feel good and you could only be doing it for the feeling of self acomplishment.,,,,francisco_quispe,,,1510152161,t5_2sml9,t3_7bkw3q,t1_dpiuoer,-1,1512428208,1,0,dpivwgy,AskSocialScience,,,
"If we accept that reasoning, then that probably happens for literally every ""moral"" action.",,,,IAmNotAPerson6,,,1510152853,t5_2sml9,t3_7bkw3q,t1_dpivwgy,5,1512428539,0,0,dpiwi40,AskSocialScience,,,
Exactly. So you could argue that humans are in nature selfish.,,,,francisco_quispe,,,1510153765,t5_2sml9,t3_7bkw3q,t1_dpiwi40,-5,1512429034,0,0,dpixay2,AskSocialScience,,,
"You could, but it'd probably be better to assume not for the time being so the question is answerable, especially since this isn't a philosophy subreddit.",,,,IAmNotAPerson6,,,1510153865,t5_2sml9,t3_7bkw3q,t1_dpixay2,1,1512429079,0,0,dpixe5d,AskSocialScience,,,
"Its not my point of view though. But i think it raises a valid point and i find interesting the discussion it creates. Hopefully someone who knows more can answer it empirically, i can see how it borders philosophy.",,,,francisco_quispe,,,1510154353,t5_2sml9,t3_7bkw3q,t1_dpixe5d,2,1512429307,0,0,dpixu4l,AskSocialScience,,,
Like if people had to vote on laws that had 0 impact on them. Would they vote morally?,,,,vulcan583,,,1510154476,t5_2sml9,t3_7bkw3q,t1_dpiuoer,5,1512429374,0,0,dpixy7d,AskSocialScience,,,
"Sure, it just seems semi-pedantic to bring up. Obviously, measuring what OP's asking for requires some definition of ""no impact,"" but the ""everything's done for yourself"" view is just one way of doing it and the only one that comes up with an immediate of answer ""no,"" which probably isn't what the OP is looking for since he even asked the question in the first place.",,,,IAmNotAPerson6,,,1510154960,t5_2sml9,t3_7bkw3q,t1_dpixu4l,3,1512429665,0,0,dpiyefk,AskSocialScience,,,
[deleted],,,,[deleted],,,1510155602,t5_2sml9,t3_7bkw3q,t1_dpixy7d,1,1512430028,0,0,dpiz041,AskSocialScience,,,
"What is an ""immoral"" vote? You can tar your opponents on an issue as immoral, but in most cases it's nonsense. People are allowed to have different values from you, and in fact, they think *you* are the immoral one.",,,,random_number_string,,,1510155817,t5_2sml9,t3_7bkw3q,t1_dpixy7d,3,1512430166,1,0,dpiz7jg,AskSocialScience,,,
"Yeah, you are right. Definetely invalidates the discussion he was trying to make.",,,,francisco_quispe,,,1510156199,t5_2sml9,t3_7bkw3q,t1_dpiyefk,2,1512430419,0,0,dpizkfe,AskSocialScience,,,
"I don't think that question can be answered empirically. How would you even measure it?

If 1) You define self interested behaviour as that which gives you self satisfaction and 2) argue that all actions, even altruistic behaviour, can be reduced to giving yourself satisfaction, you have a definition that is not falsifiable. If those are your definitions, anything can be explained in terms of selfishness. I'm not saying you're wrong, but that doesn't sound like something you can empirically rebut or prove. ",,,,ManWithAMasterplan,,,1510156291,t5_2sml9,t3_7bkw3q,t1_dpixu4l,2,1512430468,0,0,dpiznl5,AskSocialScience,,,
"This isn't exactly the original question but:

In Economics we often assume people will act on their preferences or if something is in their self-interest. But what if they zero skin in the game? What if it doesn't matter to them?",,,,vulcan583,,,1510156942,t5_2sml9,t3_7bkw3q,t1_dpiyefk,1,1512430838,0,0,dpj0acj,AskSocialScience,,,
"Ok, not op but I have a convoluted hypothetical law. A law that requires every 3rd child to be killed on their 3rd birthday. This doesn't affect hypothetical Andy because he has no living family members and he is infertile",,,,s0m30n3e1s3,,,1510157253,t5_2sml9,t3_7bkw3q,t1_dpiz7jg,2,1512431032,0,0,dpj0l69,AskSocialScience,,,
"Dictators don't generally let people vote on things like that. ",,,,random_number_string,,,1510157507,t5_2sml9,t3_7bkw3q,t1_dpj0l69,-12,1512431168,0,0,dpj0u5f,AskSocialScience,,,
[deleted],,,,[deleted],,,1510158561,t5_2sml9,t3_7bkw3q,t1_dpivwgy,1,1512431818,0,0,dpj1w4f,AskSocialScience,,,
[deleted],,,,[deleted],,,1510158802,t5_2sml9,t3_7bkw3q,t1_dpj0acj,1,1512431950,0,0,dpj2520,AskSocialScience,,,
"I wish I could help you, but I don't know. The other person has a point to a certain extent in that people still donate, volunteer, and whatnot, but that obviously also means they're interested in it somewhat, so we've gotta at least talk about what no skin in the game means.

I would suspect that the way people act on things that don't matter to them is largely dependent on how much effort they have to exert, meaning the more they have to do, the less they'll do it (unless it's just giving money, since that's more abstracted from work I'd think they're more likely to give). But there is an important difference between ""doesn't matter to them"" and ""doesn't impact them,"" as you pointed out. I would think people would act more on things that don't impact them, because those kinds of things can still matter to them.",,,,IAmNotAPerson6,,,1510158990,t5_2sml9,t3_7bkw3q,t1_dpj0acj,2,1512432069,0,0,dpj2bzg,AskSocialScience,,,
"Christ, it's a thought experiment. ",,,,IAmNotAPerson6,,,1510159981,t5_2sml9,t3_7bkw3q,t1_dpj0u5f,9,1512432675,0,0,dpj3cr5,AskSocialScience,,,
"Prosocial punishment is a pretty good example. In dictator game experiments designed to test third party punishment there's a common result where people will pay to punish someone they observe making an unfair offer. This appears across cultures. We also see the inverse result with antisocial punishment. People will punish people they observe being too generous. 

see Fehr et al ""Third Party Punishment and Social Norms"" 2004 Evolution and Human Behavior

",,,,Erinaceous,,,1510160121,t5_2sml9,t3_7bkw3q,t3_7bkw3q,4,1512432752,0,0,dpj3hx6,AskSocialScience,,,
"It's a straw man.

ETA: What is with the downvotes? Such a horrific (racist? sexist? what is the motivation for it?) law would not be put to a vote. Conversely, if there was an extraordinarily compelling reason to do this, then it wouldn't be immoral to vote for it.",,,,random_number_string,,,1510160137,t5_2sml9,t3_7bkw3q,t1_dpj3cr5,-11,1512432761,0,0,dpj3iie,AskSocialScience,,,
"But could you not argue that sometimes politicians that would not be impacted by a law might have *more* of an incentive to vote purely morally? Skin in the game might be a useful concept sometimes, but would you want industrialists to set environmental regulations? The financial industry to set financial regulations? In some cases ""skin in the game"" sounds like it creates a potential for corruption.

Furthermore, the nature of collective actions problems is that everybody's skin in the game is less than the total harm the problem will create. So I don't think its a particularly helpful concept when it comes to say global warming or overfishing.",,,,ManWithAMasterplan,,,1510160808,t5_2sml9,t3_7bkw3q,t1_dpixy7d,7,1512433128,0,0,dpj470z,AskSocialScience,,,
"I still have trouble with the inequality = innovation argument. plenty of inventions - especially the every day ones - came from personal creativity, pure dumb luck, or, as the old saying goes, necessity. of course, there's always going to be people like Gates and Jobs who are actively seeking a marketable innovation but that's not *always* the case. thus I would argue that the connection is contingent on context. (of course this is the historian in me speaking). 

in other words, I think one has to make certain assumptions - and assume certain definitions - to make the inequality = innovation connection. ",,,,rustyarrowhead,,,1510162113,t5_2sml9,t3_7befi4,t1_dpin2kt,3,1512433880,0,0,dpj5j6o,AskSocialScience,,,
"There's evidence that they do, at least when they have a moral conviction about whatever they're doing.  For instance, the classic Milgram experiments seemed to demonstrate that people will follow the orders of an authority in most cases, even when the authority demands that they do patently immoral things.  But recent studies seem to show this isn't the case, since no one actually evaluated whether people thought of their actions as moral or immoral (e.g. Skitka et al. 2005).  So, for example, having a moral conviction against torture makes subjects more resistant to majority influence.  When study confederates express positive views on torture, the subjects with higher moral conviction resisted changing their views, while those with less moral conviction changed their views in response to the peer pressure (Aramovich et al. 2012).

Aramovich, N. P., Lytle, B. L., &amp; Skitka, L. J. (2012). Opposing torture: Moral conviction and resistance to majority influence. Social Influence, 7(1), 21–34. https://doi.org/10.1080/15534510.2011.640199

Skitka, L. J., Bauman, C. W., &amp; Sargis, E. G. (2005). Moral conviction: Another contributor to attitude strength or something more? Journal of Personality and Social Psychology, 88(6), 895–917. https://doi.org/10.1037/0022-3514.88.6.895",,,,Fronesis,,,1510163184,t5_2sml9,t3_7bkw3q,t3_7bkw3q,3,1512434560,0,0,dpj6nmw,AskSocialScience,,,
"Except a subordinate has skin in the game - their job. ",,,,random_number_string,,,1510163335,t5_2sml9,t3_7bkw3q,t1_dpj6nmw,0,1512434655,0,0,dpj6t9e,AskSocialScience,,,
"I never claimed that it is the sole reason for innovation. I am not saying people are just selfish actors out for their own again. Financial incentives don't account for why Apple or Microsoft exist. But it plays *a* role for sure.

Again, consider consider the collectivised farms in China. There was little relationship between the inputs of farmers and their compensation. There was no possibility to be fired. People only worked for the ""collective good."" This was terrible for productivity. China's farms were more productive in 1949, before the revolution, than in 1978. Then what happened? A single village decided to (illegally) carve up the land they collectively owned into individual plots. Families were allowed to keep the surplus they created on their own plot. Then what?

 &gt; A rapid turnaround followed. The farmers of Xiaogang immediately became more productive. “Now is different from the past,” one said. “We work for ourselves.” Working their own plots of land, they could see a direct link between their effort and their rewards. Any of their output beyond what they owed the state they now retained to use for themselves or to sell. The amount of land planted in rice nearly doubled in one year, and the village began producing a rice surplus. As a farmer said, “You can’t be lazy when you work for your family and yourself.”

So what happened with output? It rose enormously. There was no more hunger. Everybody was better off, because everybody became more productive. But it inevitably creates inequality. Some people are more productive than others. Some people come up with better ideas than others. Some people just work harder than others. But if everybody was better off than before, why is it a bad thing that those who do their job better than their neighbour also get a little more money?

The Chinese government under Deng adopted this view, and got rid of collectivised farming over the 1980s. The number of rural poor fell by 170 million between 1978 and 1984.

I am not at all claiming poor people are poor because they do not work hard. I am not saying there should be no social safety net or that there would be zero innovation without financial incentives. But market reform and the personal incentives they created were massive drivers of both inequality and living standards. ",,,,ManWithAMasterplan,,,1510166668,t5_2sml9,t3_7befi4,t1_dpj5j6o,3,1512436718,0,0,dpja8nu,AskSocialScience,,,
[removed],,,,[deleted],,,1510170031,t5_2sml9,t3_7bkw3q,t3_7bkw3q,1,1512438768,0,0,dpjdml2,AskSocialScience,,,
This submission has been removed as this subreddit is not intended to provide personal advice. I suggest a sub like /r/resumes instead. Thank you.,,,,MoralMidgetry,,,1510173515,t5_2sml9,t3_7bh758,t3_7bh758,1,1512440854,0,0,dpjh2ld,AskSocialScience,,moderator,
"Why wouldn't they feel good about acting morally in that situation? 

They'd be more likely to do it because it doesn't cost them anything.",,,,Fibonacci35813,Social Psychology &amp; Consumer Behavior,,1510175862,t5_2sml9,t3_7bkw3q,t1_dpixy7d,2,1512442237,0,0,dpjje07,AskSocialScience,,,psych
"Dunning, Eric, Patrick J. Murphy, and John Williams. The roots of football hooliganism (RLE sports studies): An historical and sociological study. Vol. 2. Routledge, 2014.   
   
Taylor, Ian. ""Football mad: A speculative sociology of football hooliganism."" The sociology of sport 4 (1971): 357-377.   
   
Dunning, Eric. Fighting fans: Football hooliganism as a world phenomenon. Univ College Dublin Pr, 2002.    
   
Stott, Clifford, and Geoff Pearson. Football'hooliganism': policing and the war on the'English disease'. London: Pennant Books, 2007.   
   
Frosdick, Steve, and Peter Marsh. Football hooliganism. Routledge, 2013.   
   
Giulianotti, Richard. ""Participant observation and research into football hooliganism: Reflections on the problems of entree and everyday risks."" Sociology of Sport Journal 12.1 (1995): 1-20.
   
Dunning, Eric. ""Towards a sociological understanding of football hooliganism as a world phenomenon."" European Journal on Criminal Policy and Research 8.2 (2000): 141-162.   
   
Spaaij, Ramón. ""Men like us, boys like them: Violence, masculinity, and collective identity in football hooliganism."" Journal of Sport and Social Issues 32.4 (2008): 369-392.   
   
Stott, Clifford, et al. ""Variability in the collective behaviour of England fans at Euro2004:‘Hooliganism’, public order policing and social change."" European journal of social psychology 37.1 (2007): 75-100.   
   
King, Anthony. ""Violent pasts: collective memory and football hooliganism."" The Sociological Review 49.4 (2001): 568-585.   
   
Stott, Clifford, et al. ""Tackling football hooliganism: A quantitative study of public order, policing and crowd psychology."" Psychology, Public Policy, and Law 14.2 (2008): 115.   
   
Tsoukala, Anastassia. Football hooliganism in Europe: Security and civil liberties in the balance. Springer, 2009.   
   
Ganev, Venelin I. ""Post-accession hooliganism: Democratic governance in Bulgaria and Romania after 2007."" East European Politics and Societies 27.1 (2013): 26-44.   
   
Van Limbergen, Kris, Carine Colaers, and Lode Walgrave. ""The societal and psycho-sociological background of football hooliganism."" Current Psychology 8.1 (1989): 4-14.",,,,j_s_lebach,,,1510178735,t5_2sml9,t3_7bmq6n,t3_7bmq6n,3,1512443828,0,0,dpjm4ga,AskSocialScience,,,
"Australia is having a non-binding, non-compulsory postal survey on legalising same-sex marriage. Technically, this only affects a small percentage of the population (maybe 10%?). Over 60% of voters in Australia have returned their forms so far. ",,,,Matti_Matti_Matti,,,1510179135,t5_2sml9,t3_7bkw3q,t1_dpixy7d,5,1512444020,0,0,dpjmhfj,AskSocialScience,,,
