body,score_hidden,archived,name,author,author_flair_text,downs,created_utc,subreddit_id,link_id,parent_id,score,retrieved_on,controversiality,gilded,id,subreddit,ups,distinguished,author_flair_css_class
"I like Sherry turkles stuff about identity in the age of the internet

Edit

I guess the work of art in the age of mechanical reproduction by Walter Benjamin relates to your question OP",,,,StWd,,,1509702198,t5_2sml9,t3_7ahmvu,t3_7ahmvu,3,1512079888,0,0,dpa5em5,AskSocialScience,,,
"I would suggest searching for any author working in the field of Technology Studies. Start with Langdon Winner: ""[Do Artifacts Have Politics](https://www.cc.gatech.edu/~beki/cs4001/Winner.pdf)"" and Bijker, Hughes &amp; Pinch: ""[The Social Construction of Technological Systems](https://bibliodarq.files.wordpress.com/2015/09/bijker-w-the-social-construction-of-technological-systems.pdf)"" Follow this network of scholars/citations and you'll find just about every sociologist who has written about technology in the past 30 years.

You can also never go wrong with Foucault (Discipline &amp; Punish), and for something marginally more current, I really like Poster's ""[What the Matter with the Internet?](https://www.upress.umn.edu/book-division/books/whatas-the-matter-with-the-internet)""",,,,nwfisk,,,1509705629,t5_2sml9,t3_7ahmvu,t3_7ahmvu,9,1512080692,0,0,dpa6oaf,AskSocialScience,,,
"Her more recent stuff is really... [not great](https://thesocietypages.org/cyborgology/2016/08/08/make-conversation-great-again/). ",,,,nwfisk,,,1509705685,t5_2sml9,t3_7ahmvu,t1_dpa5em5,1,1512080708,0,0,dpa6p4q,AskSocialScience,,,
"I've only read the older stuff from like the 90s iirc, trying to think of more stuff related to OPs question now",,,,StWd,,,1509705761,t5_2sml9,t3_7ahmvu,t1_dpa6p4q,3,1512080723,0,0,dpa6qa3,AskSocialScience,,,
"True it's not entirely obvious, but as a non-philosophist, I don't find most of those arguments all that convincing. A lot of them seem to be arguing from ignorance. As my link shows, I do believe that qualities used in the evaluation of beauty are objective. But the determination itself, is something beautiful?, must occur in the brain as an interaction of individual perception and relevance of the quality. I guess another version of this argument would be to compare it to color perception. Color isn't an inherent property of things, it is a perception. ",,,,late4dinner,,,1509714166,t5_2sml9,t3_7a77eh,t1_dp98nmj,3,1512083497,0,0,dpabc56,AskSocialScience,,,
"In French you can try Céline Lafontaine, if you can find some translations.",,,,Maelor,,,1509715233,t5_2sml9,t3_7ahmvu,t3_7ahmvu,2,1512083937,0,0,dpac54d,AskSocialScience,,,
Check actor-network theory,,,,Mcp222,,,1509715929,t5_2sml9,t3_7ahmvu,t3_7ahmvu,2,1512084258,0,0,dpacp1k,AskSocialScience,,,
"for all of her flaws though, banks and jurgenson love to use turkle as a punching bag just like they do nick carr

for the op, here is the reading list ppl like banks have to read at RPI (where the author of that cyborgology piece was at, also home of Langdon Winner one of the top dogs in the area) 

http://www.sts.rpi.edu/pl/science-studies-reading-list

most of this revolves around science but my bet is it's more material than you care to see at this point, which is why i'd suggest reading the work of the following:

- Lewis Mumford (american, historical, broad view), 

- Jacques Ellul (french, pessimistic, historical and theoretical, blamed for techno-dystopian views), 

- Don Ihde (american, underread, phenomenological, abstract)

- N. Kathrine Hayles (american, feminist, relates to contemporary digital tech), Bruno Latour (french, anthropological/sociologist, invented actor network theory to account for machines as active entities) 

- Arnold Pacey (american, historian, talks about comparative technology in different social contexts) ",,,,Noumenology,Media Studies,,1509720240,t5_2sml9,t3_7ahmvu,t1_dpa6p4q,2,1512086565,0,0,dpagjx1,AskSocialScience,,,comm
"Agamban's ""What is an Apparatus"" is a good followup to Foucualt, I'd also suggest Power/Knowledge which hits on governmentality a bit more directly",,,,Noumenology,Media Studies,,1509720734,t5_2sml9,t3_7ahmvu,t1_dpa6oaf,2,1512086831,0,0,dpah1ak,AskSocialScience,,,comm
*Risk Society: Towards a New Modernity* by Ulrich Beck is a good read on this topic.,,,,fjandi,,,1509720861,t5_2sml9,t3_7ahmvu,t3_7ahmvu,5,1512086912,0,0,dpah5qx,AskSocialScience,,,
This question has been removed as it's not suitable for this subreddit.,,,,MoralMidgetry,,,1509732371,t5_2sml9,t3_7akb2j,t3_7akb2j,1,1512093834,0,0,dpasu0j,AskSocialScience,,moderator,
I realize this is several months old but I was just looking up Color Climax Corporation and came open this. Any suggested reading for learning about the fucked up history of childporn?,,,,Clubberlangs_EvilSis,,,1509735650,t5_2sml9,t3_6evcim,t1_dii2ro4,1,1512095770,0,0,dpaw1i7,AskSocialScience,,,
[removed],,,,[deleted],,,1509740175,t5_2sml9,t3_7a2yg1,t3_7a2yg1,0,1512098347,0,0,dpb0hzo,AskSocialScience,,,
This might be better suited to r/changemyview,,,,blasto_blastocyst,,,1509742964,t5_2sml9,t3_7am84e,t3_7am84e,6,1512099930,0,0,dpb368t,AskSocialScience,,,
"I guess it certainly is an inconvenient topic.

I appreciate that the ideas might suggest that rape be treated less seriously.  This does not necessarily follow.  Men need to control their behavior, whether it originates in lust or otherwise.  Strict penalties, including long prison terms, are justified in most rape cases.  ",,,,Markdd8,,,1509743153,t5_2sml9,t3_7am84e,t1_dpb368t,0,1512100037,0,0,dpb3chg,AskSocialScience,,,
I was thinking the same.,,,,Halostar,,,1509743313,t5_2sml9,t3_7am84e,t1_dpb368t,1,1512100124,0,0,dpb3hje,AskSocialScience,,,
[deleted],,,,[deleted],,,1509744344,t5_2sml9,t3_7am84e,t3_7am84e,1,1512100674,0,0,dpb4f9q,AskSocialScience,,,
"Where is the question? Take this somewhere else, there is nothing scientific to this post. ",,,,karl_hungas,Substance Abuse,,1509744577,t5_2sml9,t3_7am84e,t3_7am84e,3,1512100793,0,0,dpb4mpm,AskSocialScience,,,psych
"Surprised nobody has mentioned Heidegger yet (maybe he’s more a philosopher than a sociologist?), *The Question Concerning Technology* directly tackles the topic, and he touches on in *Being and Time*.",,,,faue,,,1509745221,t5_2sml9,t3_7ahmvu,t3_7ahmvu,1,1512101112,0,0,dpb577h,AskSocialScience,,,
You didn't ask a question and your proposed explanations for predatory male behavior aren't scientific or based on any hard data. It's just stereotypes.,,,,dman24752,,,1509746584,t5_2sml9,t3_7am84e,t1_dpb3chg,2,1512101778,0,0,dpb6dmk,AskSocialScience,,,
"There is a clear question near the bottom.  And I consider the  question of *what role does male lust have in the incidence of rape and sex harassment of women* an eminently fair sociological topic.

My position, if it is not clear in the OP, is that the causes and motivations for rape are nuanced, not black and white.",,,,Markdd8,,,1509749698,t5_2sml9,t3_7am84e,t1_dpb6dmk,0,1512103267,0,0,dpb8znj,AskSocialScience,,,
"This submission has been removed as it's not a specific and answerable social science question. Generally, simply posting opinions and then asking for discussion or rebuttal is not permitted in this subreddit. As others have suggested, CMV or one of the debate subs is probably more suitable for this post.",,,,MoralMidgetry,,,1509750336,t5_2sml9,t3_7am84e,t3_7am84e,2,1512103558,0,0,dpb9ie5,AskSocialScience,,moderator,
[removed],,,,[deleted],,,1509752115,t5_2sml9,t3_7an3xd,t3_7an3xd,7,1512104377,0,0,dpbaxx9,AskSocialScience,,,
[removed],,,,[deleted],,,1509498672,t5_2sml9,t3_79yuuv,t1_dp5tqno,2,1512000548,0,0,dp656gq,AskSocialScience,,,
"That would be one kind of example. Another might be videos by particularly popular YouTube personalities. Or, the people that those personalities watch. 

For example, a video by Markiplier is probably more likely to go viral than a video by someone with one subscriber. Additionally, a video by someone with only one subscriber is going to be much more likely to go viral if that subscriber is Markiplier than if it is their sibling who is also more or less unknown.

If you want to think in other formats, people like the Kardashians are in a much better position to start the viral ball-rolling, or to magnify another person’s post if they are in a position to see it.

It is a case of network centrality, and access to the power that comes from that centrality.",,,,AhsasMaharg,,,1509518273,t5_2sml9,t3_79umhr,t1_dp5swos,2,1512008142,0,0,dp6hhq7,AskSocialScience,,,
[removed],,,,[deleted],,,1509520811,t5_2sml9,t3_79yuuv,t3_79yuuv,8,1512008671,0,0,dp6id95,AskSocialScience,,,
"Thanks for the response! It somehow reminds me of the concept of opinion leader. Does it work ini similar way?

Also Qinhuangdi's question makes me wonder of something. Does SNA see the difference between platform (where it is distributed) and actor (who distribute it)? ",,,,Ikhtilaf,,,1509521415,t5_2sml9,t3_79umhr,t1_dp6hhq7,1,1512008797,0,0,dp6ikhq,AskSocialScience,,,
"It does work in a very similar manner to an opinion leader! One way of identifying opinion leaders would be to use SNA to look for actors in a network who express an opinion/behaviour/whatever that is then picked up afterwards by their neighbours. In general, one would expect opinion leaders to be in central positions, although it may be the case that not every central actor is an opinion leader. 

As for the second question, there are two broad ways to answer it. The first is the simplest. SNA can see a difference between platform and actor. One could model a bipartite network (a network made up of two kinds of nodes) consisting of actors, platforms, and memberships. Or, one could create a unipartite network that consists of just actors, with platform as a nodal attribute. Or one could make a multiplex network. There are many variations depending on the research question and the analysis one would like to perform. 

The second answer, which is more of an explanation of the first one, is that SNA is not really a theory like Marxism or Critical Race Theory. It is more like a framework for addressing questions that have certain underlying assumptions: 1) there is some kind of network of relations between things, and 2) the structure of that network is important. 

In this particular case, it would seem to make sense to think that viral posts/videos/messages spread through some kind of network, and the structure of that network is probably important. Thus, SNA is an appropriate framework for trying to understand the phenomenon. Because it is so broad, SNA can see a difference between platform and actor, provided the researcher cares to make that distinction. SNA may also not see a difference between the two if the researcher doesn't believe the distinction is important. 

This broadness also makes it really hard to nail down what SNA ""sees"" or ""says"". Aside from those two assumptions, SNA doesn't usually dictate much, but is rather informed by more specific theories that then drive how one approaches a problem. 

TL,DR: I've used a whole lot of words to say ""SNA doesn't tell you what to see, but it can make that distinction if the researcher thinks it should, and then provide a means of performing quantitative or qualitative research to further explore the issue.""

",,,,AhsasMaharg,,,1509525470,t5_2sml9,t3_79umhr,t1_dp6ikhq,1,1512009545,0,0,dp6jusb,AskSocialScience,,,
How would you establish controls for this experiment and how would this be ethical?,,,,woodsja2,,,1509535744,t5_2sml9,t3_79yuuv,t3_79yuuv,-2,1512011623,1,0,dp6ngkr,AskSocialScience,,,
"They're asking for an answer, not proposing a study.",,,,[deleted],,,1509536777,t5_2sml9,t3_79yuuv,t1_dp6ngkr,4,1512011877,0,0,dp6nxmz,AskSocialScience,,,
And I'm saying it likely isn't done because of the ethical and control study issues.,,,,woodsja2,,,1509537033,t5_2sml9,t3_79yuuv,t1_dp6nxmz,0,1512011942,1,0,dp6o25x,AskSocialScience,,,
The vast majority of social science isn't done through control trials. They are not a gold standard.,,,,theYword,,,1509538997,t5_2sml9,t3_79yuuv,t1_dp6o25x,8,1512012548,0,0,dp6p40c,AskSocialScience,,,
"Well, the original poster would still need to be more specific than ""welfare"" since some sort of societal welfare has been in place for a long time, and it'd be difficult to get society wide statistics on that sort of thing.

I can imagine someone in behavior psychological/economics having done an experiment about how having a safety net affects risk tolerance, but that's not exactly getting leverage on the problem.

Edit: I spoke too soon. [This article](https://dash.harvard.edu/bitstream/handle/1/32969786/rest_a_00068.pdf?sequence=1) from 2011 shows there's a correlation between the timing of welfare payments in 10 cities and financially motivated crimes, basically saying that welfare payments centered solely around the beginning of the month lead to crime later on, while welfare payments disbursed throughout the month lessened the effect. It's not a silver bullet, and is more about how the temporal spacing of payments affects crime (not the presence or absence of such programs) but it's a start.

Turns out there's a lot on this.",,,,just_works_here,Public and International Affairs,,1509540031,t5_2sml9,t3_79yuuv,t1_dp6p40c,6,1512012920,0,0,dp6pqjk,AskSocialScience,,,polisci
"Prospective or retrospective comparing crime rates before/after a change in welfare status for a group, vs. comparing 2 similar regions in which one offers more benefits from the other.  Similar to most population based social science research, controlling for confounders would be required in a multivariate analysis.",,,,ohnodapopo,,,1509542464,t5_2sml9,t3_79yuuv,t1_dp6ngkr,2,1512013876,0,0,dp6rdt3,AskSocialScience,,,
"Oh I agree, control trials on small specific parts of welfare might be insightful. But OP's question is way more general so I would think that RCT's have less power here.",,,,theYword,,,1509542816,t5_2sml9,t3_79yuuv,t1_dp6pqjk,3,1512014031,0,0,dp6rn5j,AskSocialScience,,,
"For sure. This has to be tackled with a Natural or Quasi-experimental design, or comparative designs like the one I cited.",,,,just_works_here,Public and International Affairs,,1509543248,t5_2sml9,t3_79yuuv,t1_dp6rn5j,1,1512014206,0,0,dp6ryqb,AskSocialScience,,,polisci
[removed],,,,[deleted],,,1509549665,t5_2sml9,t3_7a2yg1,t3_7a2yg1,2,1512017371,0,0,dp6xg2z,AskSocialScience,,,
"Well, Goffman is actually considered a ""contemporary"" theorist. He started his professional academic life in the early 1950s. 

Judith Butler is a great resource in terms of theorists who draw heavily from Goffman. However, **a lot** of theorists and academics draw from Goffman, so it is hard to really narrow it down. I would suggest going into Google Scholar and looking at all of the work that has cited Goffman's [""presentation of self in everyday life""](https://scholar.google.com/citations?user=rahhbn0AAAAJ&amp;hl=en), as well as his work on stigma and identity management. You will see that it's been cited more than 50,000 times! ",,,,__worldpeace,Sociology,,1509555679,t5_2sml9,t3_7a34kf,t3_7a34kf,11,1512020638,0,0,dp73gpv,AskSocialScience,,,soc
[removed],,,,[deleted],,,1509560989,t5_2sml9,t3_7a2yg1,t3_7a2yg1,1,1512023484,0,0,dp78trr,AskSocialScience,,,
"Randall Collins. ""Interaction Ritual Chains"" is built on Goffman's ""Interaction Rituals"".",,,,radiohead87,,,1509563372,t5_2sml9,t3_7a34kf,t3_7a34kf,6,1512024685,0,0,dp7b60s,AskSocialScience,,,
"Craig Calhoun has edited a few introductory volumes. Check out ""Classical Sociological Theory"" and ""Contemporary Sociological Theory.""",,,,zemergency,,,1509564188,t5_2sml9,t3_79gaan,t3_79gaan,1,1512025105,0,0,dp7byxg,AskSocialScience,,,
How prominent is methodological individualism nowadays?,,,,CapitalismAndFreedom,,,1509564731,t5_2sml9,t3_7a3rrj,t3_7a3rrj,2,1512025378,0,0,dp7cifh,AskSocialScience,,,
[deleted],,,,[deleted],,,1511141604,t5_2sml9,t3_7e498a,t3_7e498a,1,1512818580,0,0,dq2jxw7,AskSocialScience,,,
"Whoa. Lots going on here. Ritual. Tradition. Philosophy. Morality. Feels like a big snarl and very murky. Are you using a certain set of definitions for these things or a framing/foundational text for the propositions you are making?

Is it necessary for the question you are asking that some philosophy preceded or at worst co-evolved with a set of behaviors? For example, are you assuming that Confucianism preceded guanxi and that quanxi arose out of Confucianism in a reasoned fashion (or survived its birth because of the Confucian ideas that were prevalent evaluated it positively)? Might it not be just as likely that a philosophy evolved to justify an existing cultural practice? You're claiming that Confucianism is the ""ghost in the machine"" of guanxi, and without the common understanding of its purpose, it should become dysfunctional? Are you saying that every farmer and artisan and merchant who ever lived in China before Mao had a perfect understanding of Confucius, and that's why guanxi worked? Or could it be that guanxi is an evolved, locally optimal strategy for minimizing uncertainty in business affairs that in turn helped to shape normative beliefs about what what it means to be a good person?   ",,,,Shazbot_Nanu,,,1511145064,t5_2sml9,t3_7e498a,t3_7e498a,4,1512820080,0,0,dq2mwt4,AskSocialScience,,,
"The main question is: in terms of ritual, do traditionalist societies show less corruption than societies that disregard ritual?

I used the example of guanxi to give an example of how this might be seen. Guanxi in contemporary China is much different than how guanxi is traditionally used, which lessens the impact of what it is meant to do. Does that make more sense?",,,,cronos844,,,1511149296,t5_2sml9,t3_7e498a,t1_dq2mwt4,2,1512821978,0,0,dq2qoy3,AskSocialScience,,,
"What are your measures for corruption, exactly? I'm sorry if you've already explained/implied them and they just went over my head, but I feel a bit lost. ",,,,traskian,Sociology,,1511150798,t5_2sml9,t3_7e498a,t1_dq2qoy3,2,1512822614,0,0,dq2rz4h,AskSocialScience,,,soc
"Sorry, no. It's just not obvious that ""disregarding ritual"" (still don't know what you mean by that or what the relationship of ""ritual"" is to ""tradition"") is a characteristic that distinguishes traditionalist from non-traditionalist societies. 

Explaining your example, you still refer to ""what [guanxi] is *meant* to do,"" which supposes a set of beliefs that gave rise to the practices (or at least gave them staying power), but now you're saying those beliefs don't in fact matter to what you're asking about. It's quite confusing.

Are you asking whether, in the process of change when traditional societies modernize, one observes a pattern like this:

Modernization --&gt; Decline in traditional beliefs regarding social cohesion --&gt; Ritualistic social cohesion practices decline --&gt; Corruption arises

where these changes are a key driver of allowing corruption.

As opposed to something else, like...

Modernization changes incentives under which traditional ritualistic social cohesion practices arose --&gt; social cohesion rituals become incapable of maintaining social cohesion --&gt; Corruption increases 

???? I'll just shut up now, because trying to tease an answerable question out of this is a job for an anthropologist. However, I'm pretty sure that your use of the word ritual is a misnomer or at least does not have a  clear meaning and your conceptualization of corruption is underdeveloped (e.g. maybe a practice that works well to promote social cohesion in a traditional society is in fact considered corruption in a modern society -- so as the society changed, did corruption increase or was it re-defined into existence?) Without clarity on these, I don't know how anyone could answer your question. ",,,,Shazbot_Nanu,,,1511185871,t5_2sml9,t3_7e498a,t1_dq2qoy3,1,1512831463,0,0,dq393g7,AskSocialScience,,,
[removed],,,,[deleted],,,1511189297,t5_2sml9,t3_7e8yo2,t3_7e8yo2,14,1512832749,0,0,dq3blly,AskSocialScience,,,
[removed],,,,[deleted],,,1511190534,t5_2sml9,t3_7e8yo2,t1_dq3blly,5,1512833279,0,0,dq3cly7,AskSocialScience,,,
[removed],,,,[deleted],,,1511191542,t5_2sml9,t3_7e8yo2,t1_dq3blly,1,1512833729,0,0,dq3dguw,AskSocialScience,,,
[removed],,,,[deleted],,,1511191861,t5_2sml9,t3_7e8yo2,t1_dq3cly7,5,1512833871,0,0,dq3dqs1,AskSocialScience,,,
[removed],,,,[deleted],,,1511192037,t5_2sml9,t3_7e8yo2,t1_dq3dguw,3,1512833944,0,0,dq3dw7m,AskSocialScience,,,
"It is pretty normal for free trade agreements to create programs for retraining. For example, [NAFTA-TAA](https://www.doleta.gov/programs/factsht/nafta.htm) was designed to reduce the impact of NAFTA on people that were hurt by the agreement:

&gt;The NAFTA-TAA Program assists workers who lose their jobs or whose hours of work and wages are reduced as a result of trade with, or a shift in production to, Canada or Mexico. The NAFTA-TAA Program provides affected workers with both rapid and early response to the threat of unemployment and the opportunity to engage in long-term training while receiving income support.

I did some Google Scholaring, but am not sure how successful these kinds of programs are.",,,,ManWithAMasterplan,,,1511193245,t5_2sml9,t3_7e8yo2,t3_7e8yo2,46,1512834497,0,0,dq3ez36,AskSocialScience,,,
[removed],,,,[deleted],,,1511193394,t5_2sml9,t3_7e8yo2,t3_7e8yo2,5,1512834566,0,0,dq3f3zc,AskSocialScience,,,
[removed],,,,[deleted],,,1511194609,t5_2sml9,t3_7e8yo2,t1_dq3dqs1,1,1512835134,0,0,dq3g87s,AskSocialScience,,,
[removed],,,,[deleted],,,1511195109,t5_2sml9,t3_7e8yo2,t3_7e8yo2,1,1512835374,0,0,dq3gp9b,AskSocialScience,,,
[removed],,,,[deleted],,,1511196548,t5_2sml9,t3_7e8yo2,t1_dq3dqs1,1,1512836075,0,0,dq3i328,AskSocialScience,,,
[removed],,,,[deleted],,,1511197252,t5_2sml9,t3_7e8yo2,t3_7e8yo2,1,1512836441,0,0,dq3iri2,AskSocialScience,,,
"We are now having a reverse problem with in the coal industry, because those people believe in Trump so much and his return to coal, those unemployed are actually refusing retraining because they think it's coming back.   ",,,,laxing22,,,1511197733,t5_2sml9,t3_7e8yo2,t1_dq3ez36,41,1512836689,0,0,dq3j7zs,AskSocialScience,,,
"&gt; but am not sure how successful these kinds of programs are.

In the US post NAFTA job training programs were notoriously ineffective.  
  
&gt;[The most important finding of the benefit-cost analysis is that. without considering the benefits
of TAA stemming from the possibility that it promotes free trade, the net benefit to society of the TAA
program as it operated under the 2002 amendments was negative $53,802 per participant.](https://wdr.doleta.gov/research/FullText_Documents/ETAOP_2013_09.pdf)  
  
Which is weird, because education is [generally beneficial to earnings](http://www.nber.org/papers/w2306.pdf), and over time only gets more so.  
  
My suspicion is that it has something to do with nature of the US economy and the lack of any kind of significant welfare state in comparison to [European contemporaries](https://pdfs.semanticscholar.org/f047/231f10bb1549572808a9a4717092e3cfb299.pdf).
  
",,,,seruko,,,1511201771,t5_2sml9,t3_7e8yo2,t1_dq3ez36,36,1512838736,0,0,dq3n5tx,AskSocialScience,,,
[removed],,,,[deleted],,,1511202112,t5_2sml9,t3_7ea1i4,t3_7ea1i4,0,1512838912,0,0,dq3nhq1,AskSocialScience,,,
"100% true - some friends and I were doing some fundraising for one of these coal-to-marcellus retraining centers, and we were told that there was plenty of retraining money because none of the miners wanted retraining - for the exact reason you mentioned, they think Trump is going to give them back their mining jobs.
 
The center then asked to put the money towards getting a speaker to come down and talk to the former miners about not raiding their pensions while waiting for Trump to create a bunch of new mining jobs.",,,,Cerebusial,,,1511206709,t5_2sml9,t3_7e8yo2,t1_dq3j7zs,18,1512841256,0,0,dq3s34y,AskSocialScience,,,
Bottom line: Trump's fucking ignorance is destroying and will destroy coal miners' lives.,,,,paleolithic,,,1511211531,t5_2sml9,t3_7e8yo2,t1_dq3s34y,35,1512843739,0,0,dq3wvkc,AskSocialScience,,,
https://i0.wp.com/gifrific.com/wp-content/uploads/2013/02/Boxer-Punch-Himself-in-Head.gif?ssl=1,,,,AlibiBreakfast,,,1511212996,t5_2sml9,t3_7e8yo2,t1_dq3wvkc,3,1512844512,0,0,dq3ybql,AskSocialScience,,,
Or you could say it's the coal miner's ignorance... Both are contributing factors,,,,Saikou0taku,,,1511213988,t5_2sml9,t3_7e8yo2,t1_dq3wvkc,29,1512845019,0,0,dq3zaot,AskSocialScience,,,
[removed],,,,[deleted],,,1511214301,t5_2sml9,t3_7e8yo2,t3_7e8yo2,3,1512845182,0,0,dq3zlvb,AskSocialScience,,,
"True, but Trump's ignorance is malicious, while theirs is more an ignorance of naivete.",,,,paleolithic,,,1511214486,t5_2sml9,t3_7e8yo2,t1_dq3zaot,17,1512845270,0,0,dq3zsc1,AskSocialScience,,,
It is sometimes the courses themselves. I lived in an area the EU classed as deprived and started to pump money into. It brought a lot of vultures in the form of private contractors who would basically defraud the government by not providing the services. I took a PLC programming course. The trainer was teaching about 3 - 4 classes and we were lucky to see him more than for an hour a day. It was a case of learning from a book if you were actually interested. For the majority of the class who were steelworkers who'd been made redundant it was a social club. They were paid their wages as part of the redundancy agreement..so 30 of them sit in class and chatted for a year. That would definitely have been a large negative benefit for the EU,,,,Allydarvel,,,1511219771,t5_2sml9,t3_7e8yo2,t1_dq3n5tx,13,1512847770,0,0,dq44oyo,AskSocialScience,,,
